{
  "schemaVersion": "1.0",
  "title": "Orbix Studio — Pitch Deck",
  "language": "en",
  "website": "https://www.orbix.studio/",
  "sourceUrl": "https://www.figma.com/design/W5FZYbLVrkrIdSb3kwpL94/Branding---Graphical-Elements?node-id=961-3139",
  "slideCount": 57,
  "sections": [
    {
      "id": "section-introduction",
      "title": "Introduction",
      "slideCount": 9,
      "slideIds": [
        1,
        2,
        3,
        4,
        5,
        6,
        7,
        8,
        9
      ],
      "readUrl": "http://127.0.0.1:5188/read/#section-introduction"
    },
    {
      "id": "section-services-process",
      "title": "Services & process",
      "slideCount": 12,
      "slideIds": [
        10,
        11,
        12,
        13,
        14,
        15,
        16,
        17,
        18,
        19,
        20,
        21
      ],
      "readUrl": "http://127.0.0.1:5188/read/#section-services-process"
    },
    {
      "id": "section-selected-work",
      "title": "Selected work",
      "slideCount": 15,
      "slideIds": [
        22,
        23,
        24,
        25,
        26,
        27,
        28,
        29,
        30,
        31,
        32,
        33,
        34,
        35,
        36
      ],
      "readUrl": "http://127.0.0.1:5188/read/#section-selected-work"
    },
    {
      "id": "section-who-we-are",
      "title": "Who we are",
      "slideCount": 8,
      "slideIds": [
        37,
        38,
        39,
        40,
        41,
        42,
        43,
        44
      ],
      "readUrl": "http://127.0.0.1:5188/read/#section-who-we-are"
    },
    {
      "id": "section-engagement-investment",
      "title": "Engagement & investment",
      "slideCount": 12,
      "slideIds": [
        45,
        46,
        47,
        48,
        49,
        50,
        51,
        52,
        53,
        54,
        55,
        56
      ],
      "readUrl": "http://127.0.0.1:5188/read/#section-engagement-investment"
    },
    {
      "id": "section-next-steps",
      "title": "Next steps",
      "slideCount": 1,
      "slideIds": [
        57
      ],
      "readUrl": "http://127.0.0.1:5188/read/#section-next-steps"
    }
  ],
  "slides": [
    {
      "id": 1,
      "title": "Company deck",
      "section": "Introduction",
      "text": "Company\nDeck\nOrbix Studio\nEurope\nDesign\n©2026\n10+ YEARS OF\nDESIGN EXPERIENCE\nSTRATEGY — UI/UX \nDEVELOPMENT\nOrbix Studio",
      "textAvailability": "extracted",
      "sourcePage": 1,
      "viewerUrl": "http://127.0.0.1:5188/#slide-1",
      "readUrl": "http://127.0.0.1:5188/read/#slide-1",
      "image": "http://127.0.0.1:5188/assets/slides/01.webp",
      "thumbnail": "http://127.0.0.1:5188/assets/slides/01-thumb.webp",
      "width": 1920,
      "height": 1080
    },
    {
      "id": 2,
      "title": "What’s inside",
      "section": "Introduction",
      "text": "What’s Inside\nSee what we do, how we work, and where we can \ntake your next big idea.\n01. Introduction\n02. Services\n06. Next Step\n04. Who We Are\n03. Case Studies\n05. Engagement\nOrbix Studio",
      "textAvailability": "extracted",
      "sourcePage": 2,
      "viewerUrl": "http://127.0.0.1:5188/#slide-2",
      "readUrl": "http://127.0.0.1:5188/read/#slide-2",
      "image": "http://127.0.0.1:5188/assets/slides/02.webp",
      "thumbnail": "http://127.0.0.1:5188/assets/slides/02-thumb.webp",
      "width": 1920,
      "height": 1080
    },
    {
      "id": 3,
      "title": "Ambitious digital experiences",
      "section": "Introduction",
      "text": "Product × Design × Growth\nbusinesses forward\nexperiences that\nmove\nWe build\nambitious\ndigital\nBy bringing brand, product, and technology together, we help \nteams launch and scale with confidence\nC l e a r e r P r o d u c t s\nB r i g h t e r g r o w t h\nOrbix Studio",
      "textAvailability": "extracted",
      "sourcePage": 3,
      "viewerUrl": "http://127.0.0.1:5188/#slide-3",
      "readUrl": "http://127.0.0.1:5188/read/#slide-3",
      "image": "http://127.0.0.1:5188/assets/slides/03.webp",
      "thumbnail": "http://127.0.0.1:5188/assets/slides/03-thumb.webp",
      "width": 1920,
      "height": 1080
    },
    {
      "id": 4,
      "title": "Our core proposition",
      "section": "Introduction",
      "text": "Product × Design × Growth\nOur Core \nProposition\nTraditional agencies deliver polished visuals. We \nbuild clear, scalable product systems that help \nambitious businesses grow.\nStrategy\nDesign\nBuild\nScale\nScalable\nSystems\nDesign and build for\nlong-term growth\nHappier\nCustomers\nBetter  experience\nStronger relationships\nBusiness\nImpact\n+300%\nOrbix Studio",
      "textAvailability": "extracted",
      "sourcePage": 4,
      "viewerUrl": "http://127.0.0.1:5188/#slide-4",
      "readUrl": "http://127.0.0.1:5188/read/#slide-4",
      "image": "http://127.0.0.1:5188/assets/slides/04.webp",
      "thumbnail": "http://127.0.0.1:5188/assets/slides/04-thumb.webp",
      "width": 1920,
      "height": 1080
    },
    {
      "id": 5,
      "title": "The problems we solve",
      "section": "Introduction",
      "text": "Product × Design × Growth\nThe Problems\nWe Solve\n01\n02\nInconsistent brand \nexperiences that weaken \ncustomer trust\nWebsites that attract \nvisitors but fail to convert\nOrbix Studio\nDesign gaps can weaken customer trust and \nslow development. We help resolve the issues \nholding your business back.\n03\n04\nComplex products that \nmake everyday tasks \ndifficult\nIncomplete design handoffs \nthat cause rework and delay \nlaunches",
      "textAvailability": "extracted",
      "sourcePage": 5,
      "viewerUrl": "http://127.0.0.1:5188/#slide-5",
      "readUrl": "http://127.0.0.1:5188/read/#slide-5",
      "image": "http://127.0.0.1:5188/assets/slides/05.webp",
      "thumbnail": "http://127.0.0.1:5188/assets/slides/05-thumb.webp",
      "width": 1920,
      "height": 1080
    },
    {
      "id": 6,
      "title": "Better product experiences",
      "section": "Introduction",
      "text": "Product × Design × Growth\nWhen your product is hard to use, users leave \nand growth slows. We help you fix what's \nholding your product back and build better \nexperiences that drive growth.\nClear UX. Scalable systems. \nDEVELOPMENT\nBetter product \nexperiences.\nOrbix Studio",
      "textAvailability": "extracted",
      "sourcePage": 6,
      "viewerUrl": "http://127.0.0.1:5188/#slide-6",
      "readUrl": "http://127.0.0.1:5188/read/#slide-6",
      "image": "http://127.0.0.1:5188/assets/slides/06.webp",
      "thumbnail": "http://127.0.0.1:5188/assets/slides/06-thumb.webp",
      "width": 1920,
      "height": 1080
    },
    {
      "id": 7,
      "title": "Our design process",
      "section": "Introduction",
      "text": "Product × Design × Growth\nOur Design\nProcess\nWe take your product from idea to launch in three \nphases: Discover the right opportunities, design better \nuser experiences, and build a product ready to grow.\n01\n02\n03\nOrbix Studio\nDiscover\nWe uncover user needs, \nbusiness goals, and product \nchallenges through research.\nDesign\nWe transform those insights into \nintuitive flows, interfaces, and \nscalable systems.\nBuild\nWe bring the design to life \nwith polished UI and \ndeveloper-ready handoff.",
      "textAvailability": "extracted",
      "sourcePage": 7,
      "viewerUrl": "http://127.0.0.1:5188/#slide-7",
      "readUrl": "http://127.0.0.1:5188/read/#slide-7",
      "image": "http://127.0.0.1:5188/assets/slides/07.webp",
      "thumbnail": "http://127.0.0.1:5188/assets/slides/07-thumb.webp",
      "width": 1920,
      "height": 1080
    },
    {
      "id": 8,
      "title": "Why product-led design matters",
      "section": "Introduction",
      "text": "Product × Design × Growth\nWhy Product-Led\nDesign Matters\nPoor product experiences lead to lower conversions and higher churn. Product-led design helps \nyou improve usability, retain customers, and support long-term growth.\nFaster Onboarding\nHigher Conversion\nStronger Retention\nScalable Feature expansion\nLong-Term Brand Value\nOrbix Studio",
      "textAvailability": "extracted",
      "sourcePage": 8,
      "viewerUrl": "http://127.0.0.1:5188/#slide-8",
      "readUrl": "http://127.0.0.1:5188/read/#slide-8",
      "image": "http://127.0.0.1:5188/assets/slides/08.webp",
      "thumbnail": "http://127.0.0.1:5188/assets/slides/08-thumb.webp",
      "width": 1920,
      "height": 1080
    },
    {
      "id": 9,
      "title": "From design to development",
      "section": "Introduction",
      "text": "Product × Design × Growth\n95+\n4.95/5\n$5B\nProducts & projects \ndelivered\n10 Years\nAverage client \nsatisfaction\nEverything Your Product Need,\nFrom Design to Development\nOrbix Studio\nCombined client \nvaluation\nBuilding digital \nproducts globally",
      "textAvailability": "extracted",
      "sourcePage": 9,
      "viewerUrl": "http://127.0.0.1:5188/#slide-9",
      "readUrl": "http://127.0.0.1:5188/read/#slide-9",
      "image": "http://127.0.0.1:5188/assets/slides/09.webp",
      "thumbnail": "http://127.0.0.1:5188/assets/slides/09-thumb.webp",
      "width": 1920,
      "height": 1080
    },
    {
      "id": 10,
      "title": "Strategy & research",
      "section": "Services & process",
      "text": "Product × Design × Growth\nStrategy &\nResearch\nWe look beyond the obvious to understand your users, \nmarket, and product. By uncovering unmet needs and \nopportunities, we give every design decision a clear \ndirection and a stronger business purpose.\nUsability\nUX/UI Design\nPerformance\nApps\nOrbix Studio",
      "textAvailability": "extracted",
      "sourcePage": 10,
      "viewerUrl": "http://127.0.0.1:5188/#slide-10",
      "readUrl": "http://127.0.0.1:5188/read/#slide-10",
      "image": "http://127.0.0.1:5188/assets/slides/10.webp",
      "thumbnail": "http://127.0.0.1:5188/assets/slides/10-thumb.webp",
      "width": 1920,